<?xml version="1.0" encoding="UTF-8" ?>
<xs:schema xmlns:xs="http://www.w3.org/2001/XMLSchema">
    <xs:element name="pedidos">
        <xs:complexType>
            <xs:sequence>
                <xs:element name="pedido" minOccurs="0" maxOccurs="unbounded">
                    <xs:complexType>
                        <xs:sequence>
                            <xs:element name="numeroSerie" type="xs:integer"/>
                            <xs:element name="cantidad" type="xs:integer"/>
                            <xs:element name="peso" type="xs:integer" minOccurs="0"/>
                        </xs:sequence>
                    </xs:complexType>
                </xs:element>
            </xs:sequence>
        </xs:complexType>
    </xs:element>
</xs:schema>